{
  "output_mode": "json",
  "color_stdout": false,
  "color_stderr": false,
  "log_level": "trace",
  "flush_each_record": true,
  "terminal_state": {
    "stdin_tty": false,
    "stdout_tty": false,
    "stderr_tty": false
  },
  "environment_hints": {
    "no_color": true,
    "force_color": false
  }
}
